{
  "$schema": "https://json-schema.org/draft/2020-12/schema",
  "$id": "urn:carla-sumo-capture:schema:vehicle-body-widths:1",
  "title": "Vehicle body widths (vehicle_body_widths.json)",
  "description": "Each vehicle body's width without its mirrors, measured from the mesh in the Unreal Editor, keyed by CARLA blueprint id.",
  "type": "object",
  "additionalProperties": false,
  "required": [
    "body_widths_version",
    "method",
    "measured",
    "vehicles"
  ],
  "properties": {
    "body_widths_version": {
      "const": 1,
      "description": "The format of this file."
    },
    "method": {
      "description": "How the widths were measured.",
      "type": "string",
      "minLength": 1
    },
    "measured": {
      "description": "When, and from what.",
      "type": "string",
      "minLength": 1
    },
    "vehicles": {
      "type": "object",
      "additionalProperties": {
        "type": "object",
        "additionalProperties": false,
        "required": [
          "length_m",
          "full_width_m",
          "body_width_m",
          "height_m"
        ],
        "properties": {
          "length_m": {
            "description": "The mesh's length, meters.",
            "type": "number",
            "exclusiveMinimum": 0
          },
          "full_width_m": {
            "description": "The mesh's whole width, meters, mirrors included. Must equal the catalogue's width_m to within a millimeter.",
            "type": "number",
            "exclusiveMinimum": 0
          },
          "body_width_m": {
            "description": "The width without mirrors and other short protrusions, meters.",
            "type": "number",
            "exclusiveMinimum": 0
          },
          "height_m": {
            "description": "The mesh's height, meters.",
            "type": "number",
            "exclusiveMinimum": 0
          }
        }
      },
      "description": "One row per blueprint id."
    }
  }
}
